{"format":"webp","mimeType":"image/webp","metadata":{},"features":{"hasMacros":false,"hasExternalLinks":false,"hasEmbeddedFiles":false,"isEncrypted":false,"hasJavaScript":false},"blocks":[{"kind":"image","mimeType":"image/webp","width":40,"height":30,"loc":{"offset":[0,0]}}],"children":[],"warnings":[],"stats":{"bytesRead":162,"durationMs":0,"truncated":false,"needsOcr":false}}