{"format":"xlsx","mimeType":"application/vnd.openxmlformats-officedocument.spreadsheetml.sheet","metadata":{"language":"en-US"},"features":{"hasMacros":false,"hasExternalLinks":false,"hasEmbeddedFiles":false,"isEncrypted":false,"hasJavaScript":false},"blocks":[{"kind":"section","role":"sheet","title":"Observations","blocks":[{"kind":"table","rows":[[{"text":"Transect","address":"A1"},{"text":"Date","address":"B1"},{"text":"Cover","address":"C1"},{"text":"Cost","address":"D1"}],[{"text":"A-1","address":"A2"},{"text":"05/14/2026","raw":46156,"address":"B2"},{"text":"37.5%","raw":0.375,"address":"C2"},{"text":"€12.50","raw":12.5,"address":"D2"}],[{"text":"A-2","address":"A3"},{"text":"05/15/2026","raw":46157,"address":"B3"},{"text":"82.0%","raw":0.82,"address":"C3"},{"text":"€8.25","raw":8.25,"address":"D3"}],[{"text":"Total","address":"A4"},{"text":"","address":"B4"},{"text":"","address":"C4"},{"text":"€20.75","raw":20.75,"address":"D4"}]],"headerRows":0,"loc":{"sheet":"Observations","range":"A1:D4","offset":[0,94]}}],"loc":{"sheet":"Observations","path":"xl/worksheets/sheet1.xml","offset":[0,94]}},{"kind":"section","role":"sheet","title":"Lookup","blocks":[{"kind":"table","rows":[[{"text":"Code","address":"A1"},{"text":"Meaning","address":"B1"}],[{"text":"A-1","address":"A2"},{"text":"North inlet","address":"B2"}],[{"text":"A-2","address":"A3"},{"text":"Outer bank","address":"B3"}]],"headerRows":0,"loc":{"sheet":"Lookup","range":"A1:B3","offset":[96,139]}}],"loc":{"sheet":"Lookup","path":"xl/worksheets/sheet2.xml","offset":[96,139]}}],"children":[],"warnings":[],"stats":{"bytesRead":6827,"durationMs":0,"truncated":false,"needsOcr":false}}