{"format":"jpeg","mimeType":"image/jpeg","metadata":{"created":"2026-05-14T08:30:00+02:00","custom":[{"name":"orientation","value":"6"},{"name":"cameraMake","value":"Docsluice Optics"},{"name":"cameraModel","value":"Fixture 1"}]},"features":{"hasMacros":false,"hasExternalLinks":false,"hasEmbeddedFiles":false,"isEncrypted":false,"hasJavaScript":false},"blocks":[{"kind":"image","mimeType":"image/jpeg","width":32,"height":24,"loc":{"offset":[0,0]}}],"children":[],"warnings":[],"stats":{"bytesRead":1080,"durationMs":0,"truncated":false,"needsOcr":false}}