{"format":"tar","mimeType":"application/x-tar","metadata":{},"features":{"hasMacros":false,"hasExternalLinks":false,"hasEmbeddedFiles":false,"isEncrypted":false,"hasJavaScript":false},"blocks":[],"children":[{"path":"field/","name":"field/","status":"skipped","sizeBytes":0},{"path":"field/plots/","name":"field/plots/","status":"skipped","sizeBytes":0},{"path":"field/plots/counts.csv","name":"field/plots/counts.csv","status":"extracted","sizeBytes":60,"mimeType":"text/csv","document":{"format":"csv","mimeType":"text/csv","encoding":"utf-8","metadata":{},"features":{"hasMacros":false,"hasExternalLinks":false,"hasEmbeddedFiles":false,"isEncrypted":false,"hasJavaScript":false},"blocks":[{"kind":"table","rows":[[{"text":"species","address":"A1"},{"text":"count","address":"B1"},{"text":"site","address":"C1"}],[{"text":"sea lavender","address":"A2"},{"text":"12","address":"B2"},{"text":"north","address":"C2"}],[{"text":"cordgrass","address":"A3"},{"text":"30","address":"B3"},{"text":"south","address":"C3"}]],"headerRows":0,"loc":{"path":"field/plots/counts.csv","offset":[0,59]}}],"children":[],"warnings":[],"stats":{"bytesRead":60,"durationMs":0,"truncated":false,"needsOcr":false}}},{"path":"field/notes.md","name":"field/notes.md","status":"extracted","sizeBytes":35,"mimeType":"text/markdown","document":{"format":"markdown","mimeType":"text/markdown","encoding":"utf-8","metadata":{},"features":{"hasMacros":false,"hasExternalLinks":false,"hasEmbeddedFiles":false,"isEncrypted":false,"hasJavaScript":false},"blocks":[{"kind":"heading","level":1,"text":"Field notes","loc":{"path":"field/notes.md","offset":[0,11]}},{"kind":"paragraph","text":"Plot B was flooded.","loc":{"path":"field/notes.md","offset":[13,32]}}],"children":[],"warnings":[],"stats":{"bytesRead":35,"durationMs":0,"truncated":false,"needsOcr":false}}},{"path":"field/latest.csv","name":"field/latest.csv","status":"listed","sizeBytes":0}],"warnings":[],"stats":{"bytesRead":4608,"durationMs":0,"truncated":false,"needsOcr":false}}