{"format":"markdown","mimeType":"text/markdown","encoding":"utf-8","metadata":{},"features":{"hasMacros":false,"hasExternalLinks":false,"hasEmbeddedFiles":false,"isEncrypted":false,"hasJavaScript":false},"blocks":[{"kind":"heading","level":1,"text":"Inline formatting","loc":{"offset":[0,17]}},{"kind":"paragraph","text":"Plain, bold, strong, italic, emphasis, both and a bold link.","runs":[{"text":"Plain, "},{"text":"bold","bold":true},{"text":", "},{"text":"strong","bold":true},{"text":", "},{"text":"italic","italic":true},{"text":", "},{"text":"emphasis","italic":true},{"text":", "},{"text":"both","bold":true,"italic":true},{"text":" and "},{"text":"a ","href":"https://example.invalid/docs"},{"text":"bold","bold":true,"href":"https://example.invalid/docs"},{"text":" link","href":"https://example.invalid/docs"},{"text":"."}],"loc":{"offset":[19,79]}},{"kind":"paragraph","text":"Call extract(bytes) or npm test in a terminal.","runs":[{"text":"Call "},{"text":"extract(bytes)","code":true},{"text":" or "},{"text":"npm test","code":true},{"text":" in a terminal."}],"loc":{"offset":[81,127]}},{"kind":"paragraph","text":"Literal markers stay: snake_case_name, 2 * 3 * 4, and a lone * star.","runs":[{"text":"Literal markers stay: snake_case_name, 2 * 3 * 4, and a lone * star."}],"loc":{"offset":[129,197]}},{"kind":"paragraph","text":"Adjacent bold runs merge.","runs":[{"text":"Adjacent "},{"text":"bold","bold":true},{"text":" "},{"text":"runs","bold":true},{"text":" merge."}],"loc":{"offset":[199,224]}}],"children":[],"warnings":[],"stats":{"bytesRead":293,"durationMs":0,"truncated":false,"needsOcr":false}}