{"format":"pdf","mimeType":"application/pdf","metadata":{"created":"2026-10-10T00:45:40Z","pageCount":1,"language":"en-US"},"features":{"hasMacros":false,"hasExternalLinks":false,"hasEmbeddedFiles":false,"isEncrypted":false,"hasJavaScript":false},"blocks":[{"kind":"section","role":"page","blocks":[{"kind":"heading","level":1,"text":"Seed Bank Inventory","loc":{"page":1,"offset":[0,19]}},{"kind":"paragraph","text":"Seed Bank Inventory","loc":{"page":1,"offset":[21,40]}},{"kind":"paragraph","text":" Coastal grasses","loc":{"page":1,"offset":[42,59]}},{"kind":"paragraph","text":" Salt meadow cordgrass","loc":{"page":1,"offset":[61,84]}},{"kind":"paragraph","text":" Spike grass","loc":{"page":1,"offset":[86,99]}},{"kind":"paragraph","text":" Flowering plants","loc":{"page":1,"offset":[101,119]}},{"kind":"paragraph","text":" Sea lavender","loc":{"page":1,"offset":[121,135]}},{"kind":"paragraph","text":"North beds (merged heading) Zone","loc":{"page":1,"offset":[137,169]}},{"kind":"paragraph","text":"Bed N1 plus N3 (vertical merge) Bed N2 High marsh","loc":{"page":1,"offset":[171,220]}},{"kind":"paragraph","text":"Inner plot (nested table) Bed N4 Low marsh","loc":{"page":1,"offset":[222,264]}}],"loc":{"page":1,"offset":[0,264]}}],"children":[],"warnings":[],"stats":{"bytesRead":29735,"durationMs":0,"truncated":false,"needsOcr":false}}