{"format":"rtf","mimeType":"application/rtf","encoding":"windows-1252","metadata":{},"features":{"hasMacros":false,"hasExternalLinks":false,"hasEmbeddedFiles":false,"isEncrypted":false,"hasJavaScript":false},"blocks":[{"kind":"header","text":"Field Notes Header — Synthetic CC0","loc":{"offset":[0,34]}},{"kind":"heading","level":1,"text":"Field Notes: Tidal Gardens","loc":{"offset":[36,62]}},{"kind":"paragraph","text":"A synthetic observation log for parser testing.","loc":{"offset":[64,111]}},{"kind":"heading","level":2,"text":"Site Overview","loc":{"offset":[113,126]}},{"kind":"paragraph","text":"Plot A is a documented shoreline site.","loc":{"offset":[128,166]}},{"kind":"paragraph","text":"Custom Outline Level Three","loc":{"offset":[168,194]}},{"kind":"paragraph","text":"This heading uses a custom style name and an explicit outline level.","loc":{"offset":[196,264]}},{"kind":"heading","level":2,"text":"Field Team","loc":{"offset":[266,276]}},{"kind":"paragraph","text":"Members record salinity, shade, and plant cover. This synthetic observation explains how notes move from the first column to the second during a long field report.","loc":{"offset":[278,441]}},{"kind":"paragraph","text":"Reading-order marker 01: east marsh samples are logged before west marsh samples in this invented field exercise.","loc":{"offset":[443,556]}},{"kind":"paragraph","text":"Reading-order marker 02: east marsh samples are logged before west marsh samples in this invented field exercise.","loc":{"offset":[558,671]}},{"kind":"paragraph","text":"Reading-order marker 03: east marsh samples are logged before west marsh samples in this invented field exercise.","loc":{"offset":[673,786]}},{"kind":"paragraph","text":"Reading-order marker 04: east marsh samples are logged before west marsh samples in this invented field exercise.","loc":{"offset":[788,901]}},{"kind":"paragraph","text":"Reading-order marker 05: east marsh samples are logged before west marsh samples in this invented field exercise.","loc":{"offset":[903,1016]}},{"kind":"paragraph","text":"Reading-order marker 06: east marsh samples are logged before west marsh samples in this invented field exercise.","loc":{"offset":[1018,1131]}},{"kind":"paragraph","text":"Reading-order marker 07: east marsh samples are logged before west marsh samples in this invented field exercise.","loc":{"offset":[1133,1246]}},{"kind":"paragraph","text":"Reading-order marker 08: east marsh samples are logged before west marsh samples in this invented field exercise.","loc":{"offset":[1248,1361]}},{"kind":"paragraph","text":"Reading-order marker 09: east marsh samples are logged before west marsh samples in this invented field exercise.","loc":{"offset":[1363,1476]}},{"kind":"paragraph","text":"Reading-order marker 10: east marsh samples are logged before west marsh samples in this invented field exercise.","loc":{"offset":[1478,1591]}},{"kind":"paragraph","text":"Reading-order marker 11: east marsh samples are logged before west marsh samples in this invented field exercise.","loc":{"offset":[1593,1706]}},{"kind":"paragraph","text":"Reading-order marker 12: east marsh samples are logged before west marsh samples in this invented field exercise.","loc":{"offset":[1708,1821]}},{"kind":"paragraph","text":"Reading-order marker 13: east marsh samples are logged before west marsh samples in this invented field exercise.","loc":{"offset":[1823,1936]}},{"kind":"paragraph","text":"Reading-order marker 14: east marsh samples are logged before west marsh samples in this invented field exercise.","loc":{"offset":[1938,2051]}},{"kind":"paragraph","text":"Reading-order marker 15: east marsh samples are logged before west marsh samples in this invented field exercise.","loc":{"offset":[2053,2166]}},{"kind":"paragraph","text":"Reading-order marker 16: east marsh samples are logged before west marsh samples in this invented field exercise.","loc":{"offset":[2168,2281]}},{"kind":"paragraph","text":"Reading-order marker 17: east marsh samples are logged before west marsh samples in this invented field exercise.","loc":{"offset":[2283,2396]}},{"kind":"paragraph","text":"Reading-order marker 18: east marsh samples are logged before west marsh samples in this invented field exercise.","loc":{"offset":[2398,2511]}},{"kind":"footer","text":"Field Notes Footer — Page 26","loc":{"offset":[2513,2541]}}],"children":[],"warnings":[],"stats":{"bytesRead":11320,"durationMs":0,"truncated":false,"needsOcr":false}}