{"format":"html","mimeType":"text/html","encoding":"utf-8","metadata":{},"features":{"hasMacros":false,"hasExternalLinks":false,"hasEmbeddedFiles":false,"isEncrypted":false,"hasJavaScript":false},"blocks":[{"kind":"heading","level":1,"text":"Inline formatting","loc":{"offset":[0,17]}},{"kind":"paragraph","text":"Plain, bold, strong, italic, emphasis, both and a bold link.","runs":[{"text":"Plain, "},{"text":"bold","bold":true},{"text":", "},{"text":"strong","bold":true},{"text":", "},{"text":"italic","italic":true},{"text":", "},{"text":"emphasis","italic":true},{"text":", "},{"text":"both","bold":true,"italic":true},{"text":" and "},{"text":"a ","href":"https://example.invalid/docs"},{"text":"bold","bold":true,"href":"https://example.invalid/docs"},{"text":" link","href":"https://example.invalid/docs"},{"text":"."}],"loc":{"offset":[19,79]}},{"kind":"paragraph","text":"Call extract(bytes), press Ctrl+C, or read output.","runs":[{"text":"Call "},{"text":"extract(bytes)","code":true},{"text":", press "},{"text":"Ctrl","code":true},{"text":"+"},{"text":"C","code":true},{"text":", or read "},{"text":"output","code":true},{"text":"."}],"loc":{"offset":[81,131]}},{"kind":"paragraph","text":"Adjacent bold runs merge.","runs":[{"text":"Adjacent "},{"text":"bold runs","bold":true},{"text":" merge."}],"loc":{"offset":[133,158]}}],"children":[],"warnings":[],"stats":{"bytesRead":484,"durationMs":0,"truncated":false,"needsOcr":false}}