{"format":"zip","mimeType":"application/zip","metadata":{},"features":{"hasMacros":false,"hasExternalLinks":false,"hasEmbeddedFiles":false,"isEncrypted":false,"hasJavaScript":false},"blocks":[],"children":[{"path":"tmp/docsluice-zip-cli/","name":"tmp/docsluice-zip-cli/","status":"skipped","sizeBytes":0},{"path":"tmp/docsluice-zip-cli/hello.fodt","name":"tmp/docsluice-zip-cli/hello.fodt","status":"extracted","sizeBytes":323,"mimeType":"application/xml","document":{"format":"xml","mimeType":"application/xml","encoding":"utf-8","metadata":{},"features":{"hasMacros":false,"hasExternalLinks":false,"hasEmbeddedFiles":false,"isEncrypted":false,"hasJavaScript":false},"blocks":[{"kind":"paragraph","text":"Docsluice legal ZIP fixture.","loc":{"path":"tmp/docsluice-zip-cli/hello.fodt/document/body/text/p","offset":[0,28]}}],"children":[],"warnings":[],"stats":{"bytesRead":323,"durationMs":0,"truncated":false,"needsOcr":false}}}],"warnings":[],"stats":{"bytesRead":558,"durationMs":0,"truncated":false,"needsOcr":false}}