{"format":"odt","mimeType":"application/vnd.oasis.opendocument.text","metadata":{"pageCount":1},"features":{"hasMacros":false,"hasExternalLinks":true,"hasEmbeddedFiles":false,"isEncrypted":false,"hasJavaScript":false},"blocks":[{"kind":"heading","level":1,"text":"Marsh Transect Diagram","loc":{"path":"content.xml","offset":[0,22]}},{"kind":"paragraph","text":"Open the transect protocol for method details.","loc":{"path":"content.xml","offset":[24,70]}},{"kind":"image","mimeType":"image/png","ref":"Pictures/1000000100000001000000012B4EA37E.png","width":10,"height":10,"loc":{"path":"content.xml","offset":[72,72]}},{"kind":"paragraph","text":"Image follows the site description.","loc":{"path":"content.xml","offset":[74,109]}}],"children":[{"path":"Pictures/1000000100000001000000012B4EA37E.png","name":"1000000100000001000000012B4EA37E.png","status":"listed","sizeBytes":70,"mimeType":"image/png"}],"warnings":[],"stats":{"bytesRead":11373,"durationMs":0,"truncated":false,"needsOcr":false}}