{"format":"eml","mimeType":"message/rfc822","metadata":{"title":"Plain note","authors":["Casey Example <casey@example.test>"],"created":"2026-10-06T09:30:00.000Z"},"features":{"hasMacros":false,"hasExternalLinks":false,"hasEmbeddedFiles":false,"isEncrypted":false,"hasJavaScript":false},"blocks":[{"kind":"table","rows":[[{"text":"Field"},{"text":"Value"}],[{"text":"From"},{"text":"Casey Example <casey@example.test>"}],[{"text":"To"},{"text":"Reader <reader@example.test>"}],[{"text":"Date"},{"text":"2026-10-06T09:30:00.000Z"}],[{"text":"Subject"},{"text":"Plain note"}]],"headerRows":1,"loc":{"offset":[0,132]}},{"kind":"paragraph","text":"Plain body marker: first line.\nSecond line stays readable.","loc":{"offset":[134,192]}}],"children":[],"warnings":[],"stats":{"bytesRead":294,"durationMs":0,"truncated":false,"needsOcr":false}}