{"format":"xlsx","mimeType":"application/vnd.openxmlformats-officedocument.spreadsheetml.sheet","metadata":{},"features":{"hasMacros":false,"hasExternalLinks":false,"hasEmbeddedFiles":false,"isEncrypted":false,"hasJavaScript":false},"blocks":[{"kind":"section","role":"sheet","title":"Data","blocks":[{"kind":"table","rows":[[{"text":"Region","address":"A1"},{"text":"Units","address":"B1"},{"text":"Revenue","address":"C1"},{"text":"","address":"D1"},{"text":"","address":"E1"},{"text":"Code","address":"F1"},{"text":"Rate","address":"G1"}],[{"text":"North","address":"A2"},{"text":"10","raw":10,"address":"B2"},{"text":"1200","raw":1200,"address":"C2"},{"text":"","address":"D2"},{"text":"","address":"E2"},{"text":"A","address":"F2"},{"text":"0.1","raw":0.1,"address":"G2"}],[{"text":"South","address":"A3"},{"text":"8","raw":8,"address":"B3"},{"text":"950","raw":950,"address":"C3"},{"text":"","address":"D3"},{"text":"","address":"E3"},{"text":"B","address":"F3"},{"text":"0.2","raw":0.2,"address":"G3"}],[{"text":"East","address":"A4"},{"text":"12","raw":12,"address":"B4"},{"text":"1430","raw":1430,"address":"C4"},{"text":"","address":"D4"},{"text":"","address":"E4"},{"text":"","address":"F4"},{"text":"","address":"G4"}],[{"text":"","address":"A5"},{"text":"","address":"B5"},{"text":"","address":"C5"},{"text":"","address":"D5"},{"text":"","address":"E5"},{"text":"","address":"F5"},{"text":"","address":"G5"}],[{"text":"","address":"A6"},{"text":"","address":"B6"},{"text":"","address":"C6"},{"text":"","address":"D6"},{"text":"","address":"E6"},{"text":"","address":"F6"},{"text":"","address":"G6"}],[{"text":"Summary row","address":"A7"},{"text":"","address":"B7"},{"text":"","address":"C7"},{"text":"","address":"D7"},{"text":"","address":"E7"},{"text":"","address":"F7"},{"text":"","address":"G7"}],[{"text":"Total","address":"A8"},{"text":"30","raw":30,"address":"B8"},{"text":"3580","raw":3580,"address":"C8"},{"text":"","address":"D8"},{"text":"","address":"E8"},{"text":"","address":"F8"},{"text":"","address":"G8"}]],"headerRows":1,"loc":{"sheet":"Data","range":"A1:G8","offset":[0,141]}},{"kind":"table","rows":[[{"text":"Region","address":"A1"},{"text":"Units","address":"B1"},{"text":"Revenue","address":"C1"}],[{"text":"North","address":"A2"},{"text":"10","raw":10,"address":"B2"},{"text":"1200","raw":1200,"address":"C2"}],[{"text":"South","address":"A3"},{"text":"8","raw":8,"address":"B3"},{"text":"950","raw":950,"address":"C3"}],[{"text":"East","address":"A4"},{"text":"12","raw":12,"address":"B4"},{"text":"1430","raw":1430,"address":"C4"}]],"headerRows":1,"caption":"Sales","loc":{"sheet":"Data","range":"A1:C4","offset":[143,208]}},{"kind":"table","rows":[[{"text":"Summary row","address":"A7"},{"text":"","address":"B7"},{"text":"","address":"C7"}],[{"text":"Total","address":"A8"},{"text":"30","raw":30,"address":"B8"},{"text":"3580","raw":3580,"address":"C8"}]],"headerRows":0,"caption":"Totals","loc":{"sheet":"Data","range":"A7:C8","offset":[210,244]}},{"kind":"table","rows":[[{"text":"Code","address":"F1"},{"text":"Rate","address":"G1"}],[{"text":"A","address":"F2"},{"text":"0.1","raw":0.1,"address":"G2"}],[{"text":"B","address":"F3"},{"text":"0.2","raw":0.2,"address":"G3"}]],"headerRows":1,"caption":"Rates","loc":{"sheet":"Data","range":"F1:G3","offset":[246,273]}},{"kind":"table","rows":[[{"text":"North","address":"A2"},{"text":"10","raw":10,"address":"B2"},{"text":"1200","raw":1200,"address":"C2"}],[{"text":"South","address":"A3"},{"text":"8","raw":8,"address":"B3"},{"text":"950","raw":950,"address":"C3"}]],"headerRows":0,"caption":"TopTwo","loc":{"sheet":"Data","range":"A2:C3","offset":[275,307]}}],"loc":{"sheet":"Data","path":"xl/worksheets/sheet1.xml","offset":[0,307]}},{"kind":"section","role":"sheet","title":"Odd 'Name'","blocks":[{"kind":"table","rows":[[{"text":"Key","address":"A1"},{"text":"Value","address":"B1"}],[{"text":"k","address":"A2"},{"text":"1","raw":1,"address":"B2"}]],"headerRows":1,"caption":"Odd","loc":{"sheet":"Odd 'Name'","range":"A1:B2","offset":[309,326]}}],"loc":{"sheet":"Odd 'Name'","path":"xl/worksheets/sheet2.xml","offset":[309,326]}}],"children":[],"warnings":[],"stats":{"bytesRead":3314,"durationMs":0,"truncated":false,"needsOcr":false}}