{"format":"pdf","mimeType":"application/pdf","metadata":{"created":"2026-10-11T03:54:54Z","pageCount":1,"language":"en-US"},"features":{"hasMacros":false,"hasExternalLinks":false,"hasEmbeddedFiles":false,"isEncrypted":false,"hasJavaScript":false},"blocks":[{"kind":"section","role":"page","blocks":[{"kind":"heading","level":1,"text":"Harbour Newsletter","loc":{"page":1,"offset":[0,18]}},{"kind":"paragraph","text":"Three columns of synthetic notes for reading-order tests","loc":{"page":1,"offset":[20,76]}},{"kind":"paragraph","text":"Note N1. The survey team walked the line at low tide, noting the plants, the soil and the water in each plot before the tide returned to cover the flats again.","loc":{"page":1,"offset":[78,237]}},{"kind":"paragraph","text":"Note N2. The survey team walked the line at low tide, noting the plants, the soil and the water in each plot before the tide returned to cover the flats again.","loc":{"page":1,"offset":[239,398]}},{"kind":"paragraph","text":"Note N3. The survey team walked the line at low tide, noting the plants, the soil and the water in each plot before the tide returned to cover the flats again.","loc":{"page":1,"offset":[400,559]}},{"kind":"paragraph","text":"Note N4. The survey team walked the line at low tide, noting the plants, the soil and the water in each plot before the tide returned to cover the flats again.","loc":{"page":1,"offset":[561,720]}},{"kind":"paragraph","text":"Note N5. The survey team walked the line at low tide, noting the plants, the soil and the water in each plot before the tide returned to cover the flats again.","loc":{"page":1,"offset":[722,881]}},{"kind":"paragraph","text":"Note N6. The survey team walked the line at low tide, noting the plants, the soil and the water in each plot before the tide returned to cover the flats again.","loc":{"page":1,"offset":[883,1042]}},{"kind":"paragraph","text":"Note N7. The survey team walked the line at low tide, noting the plants, the soil and the water in each plot before the tide returned to cover the flats again.","loc":{"page":1,"offset":[1044,1203]}},{"kind":"paragraph","text":"Note N8. The survey team walked the line at low tide, noting the plants, the soil and the water in each plot before the tide returned to cover the flats again.","loc":{"page":1,"offset":[1205,1364]}},{"kind":"paragraph","text":"Note N9. The survey team walked the line at low tide, noting the plants, the soil and the water in each plot before the tide returned to cover the flats again.","loc":{"page":1,"offset":[1366,1525]}}],"loc":{"page":1,"offset":[0,1525]}}],"children":[],"warnings":[],"stats":{"bytesRead":30551,"durationMs":0,"truncated":false,"needsOcr":false}}