{"format":"odp","mimeType":"application/vnd.oasis.opendocument.presentation","metadata":{},"features":{"hasMacros":false,"hasExternalLinks":false,"hasEmbeddedFiles":false,"isEncrypted":false,"hasJavaScript":false},"blocks":[{"kind":"section","role":"slide","blocks":[{"kind":"paragraph","text":"Slide 01","loc":{"slide":1,"path":"content.xml","offset":[0,8]}},{"kind":"paragraph","text":"Order marker 01","loc":{"slide":1,"path":"content.xml","offset":[10,25]}}],"loc":{"slide":1,"path":"content.xml","offset":[0,25]}},{"kind":"section","role":"slide","blocks":[{"kind":"paragraph","text":"Slide 02","loc":{"slide":2,"path":"content.xml","offset":[27,35]}},{"kind":"paragraph","text":"Order marker 02","loc":{"slide":2,"path":"content.xml","offset":[37,52]}}],"loc":{"slide":2,"path":"content.xml","offset":[27,52]}},{"kind":"section","role":"slide","blocks":[{"kind":"paragraph","text":"Slide 10","loc":{"slide":3,"path":"content.xml","offset":[54,62]}},{"kind":"paragraph","text":"Order marker 10","loc":{"slide":3,"path":"content.xml","offset":[64,79]}}],"loc":{"slide":3,"path":"content.xml","offset":[54,79]}},{"kind":"section","role":"slide","blocks":[{"kind":"paragraph","text":"Slide 11","loc":{"slide":4,"path":"content.xml","offset":[81,89]}},{"kind":"paragraph","text":"Order marker 11","loc":{"slide":4,"path":"content.xml","offset":[91,106]}}],"loc":{"slide":4,"path":"content.xml","offset":[81,106]}},{"kind":"section","role":"slide","blocks":[{"kind":"paragraph","text":"Slide 03","loc":{"slide":5,"path":"content.xml","offset":[108,116]}},{"kind":"paragraph","text":"Order marker 03","loc":{"slide":5,"path":"content.xml","offset":[118,133]}}],"loc":{"slide":5,"path":"content.xml","offset":[108,133]}},{"kind":"section","role":"slide","blocks":[{"kind":"paragraph","text":"Slide 04","loc":{"slide":6,"path":"content.xml","offset":[135,143]}},{"kind":"paragraph","text":"Order marker 04","loc":{"slide":6,"path":"content.xml","offset":[145,160]}}],"loc":{"slide":6,"path":"content.xml","offset":[135,160]}},{"kind":"section","role":"slide","blocks":[{"kind":"paragraph","text":"Slide 05","loc":{"slide":7,"path":"content.xml","offset":[162,170]}},{"kind":"paragraph","text":"Order marker 05","loc":{"slide":7,"path":"content.xml","offset":[172,187]}}],"loc":{"slide":7,"path":"content.xml","offset":[162,187]}},{"kind":"section","role":"slide","blocks":[{"kind":"paragraph","text":"Slide 06","loc":{"slide":8,"path":"content.xml","offset":[189,197]}},{"kind":"paragraph","text":"Order marker 06","loc":{"slide":8,"path":"content.xml","offset":[199,214]}}],"loc":{"slide":8,"path":"content.xml","offset":[189,214]}},{"kind":"section","role":"slide","blocks":[{"kind":"paragraph","text":"Slide 07","loc":{"slide":9,"path":"content.xml","offset":[216,224]}},{"kind":"paragraph","text":"Order marker 07","loc":{"slide":9,"path":"content.xml","offset":[226,241]}}],"loc":{"slide":9,"path":"content.xml","offset":[216,241]}},{"kind":"section","role":"slide","blocks":[{"kind":"paragraph","text":"Slide 08","loc":{"slide":10,"path":"content.xml","offset":[243,251]}},{"kind":"paragraph","text":"Order marker 08","loc":{"slide":10,"path":"content.xml","offset":[253,268]}}],"loc":{"slide":10,"path":"content.xml","offset":[243,268]}},{"kind":"section","role":"slide","blocks":[{"kind":"paragraph","text":"Slide 09","loc":{"slide":11,"path":"content.xml","offset":[270,278]}},{"kind":"paragraph","text":"Order marker 09","loc":{"slide":11,"path":"content.xml","offset":[280,295]}}],"loc":{"slide":11,"path":"content.xml","offset":[270,295]}},{"kind":"section","role":"slide","blocks":[{"kind":"paragraph","text":"Slide 12","loc":{"slide":12,"path":"content.xml","offset":[297,305]}},{"kind":"paragraph","text":"Order marker 12","loc":{"slide":12,"path":"content.xml","offset":[307,322]}}],"loc":{"slide":12,"path":"content.xml","offset":[297,322]}}],"children":[],"warnings":[{"code":"UNREADABLE_PART","message":"ODF manifest contains an invalid internal part entry.","loc":{"path":"META-INF/manifest.xml"}}],"stats":{"bytesRead":15053,"durationMs":0,"truncated":false,"needsOcr":false}}