{"format":"xls","mimeType":"application/vnd.ms-excel","metadata":{},"features":{"hasMacros":false,"hasExternalLinks":false,"hasEmbeddedFiles":false,"isEncrypted":false,"hasJavaScript":false},"blocks":[{"kind":"section","role":"sheet","title":"Samples","blocks":[{"kind":"table","rows":[[{"text":"Sample","address":"A1"},{"text":"Status","address":"B1"},{"text":"Owner","address":"C1"}],[{"text":"Combined header (merged cells)","colSpan":2,"address":"A2"},{"text":"","address":"B2"},{"text":"Group","address":"C2"}],[{"text":"S-11","address":"A3"},{"text":"rich text shared candidate","address":"B3"},{"text":"Field Unit","address":"C3"}],[{"text":"S-12","address":"A4"},{"text":"validated","address":"B4"},{"text":"Field Unit","address":"C4"}]],"headerRows":0,"loc":{"sheet":"Samples","range":"A1:C4","offset":[0,126]}}],"loc":{"sheet":"Samples","path":"Workbook","offset":[0,126]}}],"children":[],"warnings":[],"stats":{"bytesRead":5632,"durationMs":0,"truncated":false,"needsOcr":false}}