{"format":"rtf","mimeType":"application/rtf","encoding":"windows-1252","metadata":{},"features":{"hasMacros":false,"hasExternalLinks":false,"hasEmbeddedFiles":false,"isEncrypted":false,"hasJavaScript":false},"blocks":[{"kind":"paragraph","text":"Before","loc":{"offset":[0,6]}}],"children":[],"warnings":[{"code":"UNREADABLE_PART","message":"Some RTF content could not be read safely."}],"stats":{"bytesRead":54,"durationMs":0,"truncated":false,"needsOcr":false}}