{
  "format": "doc",
  "mimeType": "application/msword",
  "metadata": {},
  "features": {
    "hasMacros": false,
    "hasExternalLinks": false,
    "hasEmbeddedFiles": false,
    "isEncrypted": false,
    "hasJavaScript": false
  },
  "blocks": [
    {
      "kind": "heading",
      "level": 1,
      "text": "Legacy Word fixture",
      "loc": {
        "offset": [
          0,
          19
        ]
      }
    },
    {
      "kind": "paragraph",
      "text": "Paragraph with café, €12, and a visible field result: July 4, 2026.",
      "loc": {
        "offset": [
          21,
          88
        ]
      }
    },
    {
      "kind": "heading",
      "level": 2,
      "text": "Second heading",
      "loc": {
        "offset": [
          90,
          104
        ]
      }
    },
    {
      "kind": "table",
      "rows": [
        [
          {
            "text": "Item"
          },
          {
            "text": "Count"
          }
        ],
        [
          {
            "text": "Paper"
          },
          {
            "text": "3"
          }
        ]
      ],
      "headerRows": 0,
      "loc": {
        "offset": [
          106,
          124
        ]
      }
    },
    {
      "kind": "paragraph",
      "text": "Final paragraph for text recall.",
      "loc": {
        "offset": [
          126,
          158
        ]
      }
    }
  ],
  "children": [],
  "warnings": [],
  "stats": {
    "bytesRead": 10752,
    "durationMs": 0,
    "truncated": false,
    "needsOcr": false
  }
}
