{"format":"odt","mimeType":"application/vnd.oasis.opendocument.text","metadata":{"pageCount":1},"features":{"hasMacros":false,"hasExternalLinks":false,"hasEmbeddedFiles":false,"isEncrypted":false,"hasJavaScript":false},"blocks":[{"kind":"paragraph","text":"<?xml version=\"1.0\" encoding=\"UTF-8\"?>","loc":{"path":"content.xml","offset":[0,38]}},{"kind":"paragraph","text":"<office:document xmlns:office=\"urn:oasis:names:tc:opendocument:xmlns:office:1.0\" xmlns:text=\"urn:oasis:names:tc:opendocument:xmlns:text:1.0\" office:version=\"1.3\">","loc":{"path":"content.xml","offset":[40,202]}},{"kind":"paragraph","text":"<office:body><office:text><text:p>Docsluice legal ZIP fixture.</text:p></office:text></office:body>","loc":{"path":"content.xml","offset":[204,303]}},{"kind":"paragraph","text":"</office:document>","loc":{"path":"content.xml","offset":[305,323]}}],"children":[],"warnings":[{"code":"UNREADABLE_PART","message":"ODF manifest contains an invalid internal part entry.","loc":{"path":"META-INF/manifest.xml"}}],"stats":{"bytesRead":11910,"durationMs":0,"truncated":false,"needsOcr":false}}