{"format":"eml","mimeType":"message/rfc822","encoding":"utf-8","metadata":{"title":"HTML only","authors":["Casey Example <casey@example.test>"],"created":"2026-10-06T09:30:00.000Z"},"features":{"hasMacros":false,"hasExternalLinks":false,"hasEmbeddedFiles":false,"isEncrypted":false,"hasJavaScript":false},"blocks":[{"kind":"table","rows":[[{"text":"Field"},{"text":"Value"}],[{"text":"From"},{"text":"Casey Example <casey@example.test>"}],[{"text":"To"},{"text":"Reader <reader@example.test>"}],[{"text":"Date"},{"text":"2026-10-06T09:30:00.000Z"}],[{"text":"Subject"},{"text":"HTML only"}]],"headerRows":1,"loc":{"offset":[0,131]}},{"kind":"heading","level":1,"text":"HTML ONLY MARKER","loc":{"offset":[133,149]}},{"kind":"paragraph","text":"HTML body sentence.","loc":{"offset":[151,170]}}],"children":[],"warnings":[],"stats":{"bytesRead":310,"durationMs":0,"truncated":false,"needsOcr":false}}