{"format":"html","mimeType":"text/html","encoding":"utf-8","metadata":{},"features":{"hasMacros":false,"hasExternalLinks":true,"hasEmbeddedFiles":false,"isEncrypted":false,"hasJavaScript":true},"blocks":[{"kind":"heading","level":1,"text":"Workshop manual","loc":{"offset":[0,15]}},{"kind":"paragraph","text":"Use the hand plane on dry wood.","loc":{"offset":[17,48]}},{"kind":"heading","level":2,"text":"Before you begin","loc":{"offset":[50,66]}},{"kind":"list","ordered":true,"items":[{"text":"Clamp the board"},{"text":"Check the grain"}],"loc":{"offset":[68,105]}},{"kind":"paragraph","text":"Unknown elements preserve their children.","loc":{"offset":[107,148]}},{"kind":"paragraph","text":"Visit the reference guide.","loc":{"offset":[150,176]}},{"kind":"paragraph","text":"External resource below is a feature candidate:A small hand plane","loc":{"offset":[178,243]}},{"kind":"image","alt":"A small hand plane","loc":{"offset":[245,263]}},{"kind":"paragraph","text":"Sidebar marker","loc":{"offset":[265,279]}},{"kind":"paragraph","text":"Footer marker","loc":{"offset":[281,294]}}],"children":[],"warnings":[],"stats":{"bytesRead":814,"durationMs":0,"truncated":false,"needsOcr":false}}