{"format":"xlsx","mimeType":"application/vnd.openxmlformats-officedocument.spreadsheetml.sheet","metadata":{"language":"en-US"},"features":{"hasMacros":false,"hasExternalLinks":false,"hasEmbeddedFiles":false,"isEncrypted":false,"hasJavaScript":false},"blocks":[{"kind":"section","role":"sheet","title":"DateSystem","blocks":[{"kind":"table","rows":[[{"text":"Serial","address":"A1"},{"text":"Displayed date","address":"B1"}],[{"text":"0","raw":0,"address":"A2"},{"text":"01/01/1904","raw":0,"address":"B2"}],[{"text":"1462","raw":1462,"address":"A3"},{"text":"01/02/1908","raw":1462,"address":"B3"}]],"headerRows":1,"loc":{"sheet":"DateSystem","range":"A1:B3","offset":[0,50]}}],"loc":{"sheet":"DateSystem","path":"xl/worksheets/sheet1.xml","offset":[0,50]}}],"children":[],"warnings":[],"stats":{"bytesRead":5524,"durationMs":0,"truncated":false,"needsOcr":false}}