{"format":"docx","mimeType":"application/vnd.openxmlformats-officedocument.wordprocessingml.document","metadata":{"language":"en-US"},"features":{"hasMacros":false,"hasExternalLinks":false,"hasEmbeddedFiles":false,"isEncrypted":false,"hasJavaScript":false},"blocks":[{"kind":"heading","level":1,"text":"Legacy Word fixture","loc":{"path":"word/document.xml","offset":[0,19]}},{"kind":"paragraph","text":"Paragraph with café, €12, and a visible field result: July 4, 2026.","loc":{"path":"word/document.xml","offset":[21,88]}},{"kind":"heading","level":2,"text":"Second heading","loc":{"path":"word/document.xml","offset":[90,104]}},{"kind":"paragraph","text":"Item","loc":{"path":"word/document.xml","offset":[106,110]}},{"kind":"paragraph","text":"Count","loc":{"path":"word/document.xml","offset":[112,117]}},{"kind":"paragraph","text":"Paper","loc":{"path":"word/document.xml","offset":[119,124]}},{"kind":"paragraph","text":"3","loc":{"path":"word/document.xml","offset":[126,127]}},{"kind":"paragraph","text":"Final paragraph for text recall.","loc":{"path":"word/document.xml","offset":[129,161]}}],"children":[],"warnings":[],"stats":{"bytesRead":6006,"durationMs":0,"truncated":false,"needsOcr":false}}