{"format":"xlsx","mimeType":"application/vnd.openxmlformats-officedocument.spreadsheetml.sheet","metadata":{},"features":{"hasMacros":false,"hasExternalLinks":false,"hasEmbeddedFiles":false,"isEncrypted":false,"hasJavaScript":false},"blocks":[{"kind":"section","role":"sheet","title":"Budget","blocks":[{"kind":"table","rows":[[{"text":"Item","address":"A1"},{"text":"Cost","address":"B1"}],[{"text":"Pump","address":"A2"},{"text":"120","raw":120,"address":"B2"}],[{"text":"Valve","address":"A3"},{"text":"35","raw":35,"address":"B3"}]],"headerRows":1,"loc":{"sheet":"Budget","range":"A1:B3","offset":[0,27]}},{"kind":"note","role":"comment","text":"Should we split labour from parts?","author":"Ada Reviewer","loc":{"sheet":"Budget","range":"A1","path":"xl/threadedComments/threadedComment1.xml","offset":[29,63]}},{"kind":"note","role":"comment","text":"Yes, next quarter.","author":"Grace Approver","loc":{"sheet":"Budget","range":"A1","path":"xl/threadedComments/threadedComment1.xml","offset":[65,83]}},{"kind":"note","role":"comment","text":"Ada Reviewer:\nIncludes the spare seal.","author":"Ada Reviewer","loc":{"sheet":"Budget","range":"B2","path":"xl/comments1.xml","offset":[85,123]}},{"kind":"note","role":"comment","text":"Check the supplier.","author":"Ada Reviewer","loc":{"sheet":"Budget","range":"A3","path":"xl/comments1.xml","offset":[125,144]}}],"loc":{"sheet":"Budget","path":"xl/worksheets/sheet1.xml","offset":[0,144]}}],"children":[],"warnings":[],"stats":{"bytesRead":3268,"durationMs":0,"truncated":false,"needsOcr":false}}